{
  "schema": 1,
  "name": "goldeneye-007",
  "source_roots": [
    "src",
    "include",
    "assets",
    "rsp",
    "port"
  ],
  "exclude_roots": [
    "build",
    "build-pc",
    "assets/obseg"
  ],
  "notes": [
    "Reference integration profile; generic scanner must not depend on these notes.",
    "Rare engine family; custom GBI and serialized asset layouts require profile-specific validation."
  ],
  "layout_contracts": [
    {
      "type": "Vertex",
      "size": 16,
      "scope": "graphics_stride",
      "why": "Vertex must remain the 16-byte N64/gSPVertex stride"
    },
    {
      "type": "SetupIntroEmpty",
      "size": 4,
      "scope": "serialized",
      "why": "SetupIntroEmpty serialized size"
    },
    {
      "type": "SetupIntroSpawn",
      "size": 12,
      "scope": "serialized",
      "why": "SetupIntroSpawn serialized size"
    },
    {
      "type": "struct SetupIntroItem",
      "size": 16,
      "scope": "serialized",
      "why": "SetupIntroItem serialized size"
    },
    {
      "type": "struct SetupIntroAmmo",
      "size": 16,
      "scope": "serialized",
      "why": "SetupIntroAmmo serialized size"
    },
    {
      "type": "struct SetupIntroSwirl",
      "size": 32,
      "scope": "serialized",
      "why": "SetupIntroSwirl serialized size"
    },
    {
      "type": "struct SetupIntroAnim",
      "size": 8,
      "scope": "serialized",
      "why": "SetupIntroAnim serialized size"
    },
    {
      "type": "struct SetupIntroCuff",
      "size": 8,
      "scope": "serialized",
      "why": "SetupIntroCuff serialized size"
    },
    {
      "type": "SetupIntroCamera",
      "size": 40,
      "scope": "serialized",
      "why": "SetupIntroCamera serialized size"
    },
    {
      "type": "struct SetupIntroWatch",
      "size": 12,
      "scope": "serialized",
      "why": "SetupIntroWatch serialized size"
    },
    {
      "type": "CreditsEntry",
      "size": 12,
      "scope": "serialized",
      "why": "CreditsEntry serialized size"
    },
    {
      "type": "struct SetupIntroCredits",
      "size": 8,
      "scope": "serialized",
      "why": "SetupIntroCredits serialized size"
    },
    {
      "type": "RoomVtxBatchBounds",
      "size": 28,
      "scope": "serialized",
      "why": "RoomVtxBatchBounds serialized size"
    },
    {
      "type": "bg_room_data",
      "size": 24,
      "scope": "serialized",
      "why": "bg_room_data serialized stride"
    }
  ]
}
